{
  "schema_version": "1.0.0",
  "document_type": "qsol_ns_openai_2026_cd_correspondence",
  "license": "Apache-2.0",
  "as_of": "2026-09-09",
  "phase": "3A_gate_1",
  "pr12_merge_baseline": "ef48a7d7f195f475e9a0a792edbb750e74d210f0",
  "gate_status": "statement_correspondence_confirmed",
  "authority": {
    "clay_target": "research/clay_target.json",
    "external_claim_registry": "research/external_claim_registry.json",
    "openai_paper_source_id": "OPENAI_NS_BLOWUP_2026",
    "openai_formalization_source_id": "OPENAI_NS_LEAN_2026"
  },
  "formal_artifact_pin": {
    "repository": "openai/NavierStokesAndEuler",
    "commit": "8937a8f4cbc7abaab5e9e97d1cc7f5d2319d9538",
    "files": [
      {
        "path": "NavierStokes/ComparatorSolution.lean",
        "blob_sha": "cc232068cd384dbbddce2753b1fc4a4017c0f2d7"
      },
      {
        "path": "NavierStokes/ComparatorDefinitions.lean",
        "blob_sha": "d92c81ac99c1139e54c181c97d9021e975e23b7a"
      },
      {
        "path": "ComparatorChallenges/NavierStokes.lean",
        "blob_sha": "673fb19e26e60818d446363afd953f618719f99b"
      },
      {
        "path": "formalization.yaml",
        "blob_sha": "01270e9f666b0400b60d032204e02e6d684cee98"
      }
    ]
  },
  "scope": {
    "formulations": ["C", "D"],
    "statement_correspondence_only": true,
    "proof_validity_assessed": false,
    "lean_build_replayed_by_qsol": false,
    "comparator_replayed_by_qsol": false,
    "theorem_registry_promotion": false
  },
  "clay_snapshot": {
    "shared_equation_scope": {
      "dimension": 3,
      "viscosity": "nu > 0",
      "incompressible": true,
      "unknowns": ["u", "p"],
      "equations": [
        "partial_t u + (u dot grad)u = nu Delta u - grad p + f",
        "div u = 0",
        "u(x,0)=u0(x)"
      ]
    },
    "C": {
      "direction": "breakdown",
      "domain": "R^3",
      "initial_data": "there exists smooth divergence-free rapidly decaying u0 satisfying Fefferman condition (4)",
      "forcing": "there exists smooth rapidly decaying f satisfying Fefferman condition (5)",
      "required_conclusion": "no global physically reasonable solution p,u satisfying the equations, global smoothness, and bounded energy",
      "zero_force_allowed": true,
      "zero_force_required": false
    },
    "D": {
      "direction": "breakdown",
      "domain": "R^3/Z^3",
      "initial_data": "there exists smooth divergence-free spatially periodic u0 satisfying Fefferman condition (8)",
      "forcing": "there exists smooth spatially periodic f with time decay satisfying Fefferman condition (9)",
      "required_conclusion": "no global smooth spatially periodic solution p,u satisfying the equations",
      "zero_force_allowed": true,
      "zero_force_required": false
    },
    "periodic_pressure_erratum": "The pressure periodicity condition p(x+e_j,t)=p(x,t) must be made explicit in the periodic assumptions."
  },
  "correspondences": [
    {
      "formulation_id": "C",
      "external_claim_id": "OPENAI_2026_C",
      "analytical_source_statement": "Theorem 1.1",
      "lean_declaration": "NavierStokes.Comparator.navier_stokes_breakdown_R3",
      "lean_target_summary": "For every positive viscosity, there exist an initial velocity and force satisfying InitialVelocityConditionDecay and ForceConditionDecay such that no global NavierStokesExistenceAndSmoothnessRn velocity/pressure pair exists.",
      "fields": [
        {"field_id": "dimension", "clay_requirement": "three spatial dimensions", "source_or_lean_encoding": "local notation ℝ³ := EuclideanSpace ℝ (Fin 3)", "relation": "exact_match", "audit_status": "accounted_for"},
        {"field_id": "viscosity", "clay_requirement": "nu > 0", "source_or_lean_encoding": "(nu : ℝ) (hnu : nu > 0)", "relation": "exact_match", "audit_status": "accounted_for"},
        {"field_id": "domain", "clay_requirement": "R^3", "source_or_lean_encoding": "u₀ : ℝ³ → ℝ³ and f : ℝ³ → ℝ → ℝ³", "relation": "exact_match", "audit_status": "accounted_for"},
        {"field_id": "initial_data", "clay_requirement": "there exists smooth divergence-free rapidly decaying u0 satisfying Fefferman condition (4)", "source_or_lean_encoding": "InitialVelocityConditionDecay u₀ requires smoothness, divergence-free initial data, and all-order rapid spatial decay; the analytical source uses the stronger special witness u₀ = 0.", "relation": "source_special_case_satisfies_target", "audit_status": "accounted_for"},
        {"field_id": "forcing", "clay_requirement": "there exists smooth rapidly decaying f satisfying Fefferman condition (5)", "source_or_lean_encoding": "ForceConditionDecay f requires smoothness on t ≥ 0 and all-order rapid decay in space and time; the analytical source states a smooth compactly supported force, a stronger admissible special case.", "relation": "source_special_case_satisfies_target", "audit_status": "accounted_for"},
        {"field_id": "equation", "clay_requirement": "Navier-Stokes momentum equation with forcing", "source_or_lean_encoding": "NavierStokesExistenceAndSmoothness.navier_stokes encodes ∂t v + (v·∇)v = nu Δv - ∇p + f on t ≥ 0.", "relation": "exact_match", "audit_status": "accounted_for"},
        {"field_id": "incompressibility", "clay_requirement": "div u = 0", "source_or_lean_encoding": "NavierStokesExistenceAndSmoothness.div_free requires divergence zero for all x and t ≥ 0.", "relation": "exact_match", "audit_status": "accounted_for"},
        {"field_id": "initial_condition", "clay_requirement": "u(x,0)=u0(x)", "source_or_lean_encoding": "NavierStokesExistenceAndSmoothness.initial_condition requires v x 0 = u₀ x.", "relation": "exact_match", "audit_status": "accounted_for"},
        {"field_id": "global_smoothness", "clay_requirement": "global smooth velocity and pressure on R^3 x [0,infinity)", "source_or_lean_encoding": "NavierStokesExistenceAndSmoothness requires C∞ velocity and pressure on univ × [0,∞).", "relation": "exact_match", "audit_status": "accounted_for"},
        {"field_id": "bounded_energy", "clay_requirement": "bounded kinetic energy for all t ≥ 0", "source_or_lean_encoding": "NavierStokesExistenceAndSmoothnessRn requires per-time L2 membership and a uniform global kinetic-energy bound.", "relation": "exact_match", "audit_status": "accounted_for"},
        {"field_id": "breakdown_conclusion", "clay_requirement": "no global physically reasonable solution p,u satisfying the equations, global smoothness, and bounded energy", "source_or_lean_encoding": "¬ (∃ v p, NavierStokesExistenceAndSmoothnessRn nu u₀ f v p)", "relation": "exact_match", "audit_status": "accounted_for"}
      ],
      "construction_to_target_bridge": "The final Lean declaration has the exact existential/non-existence target shape. The separate proof obligation that OpenAI's constructed zero-data, compactly-supported-forcing witness satisfies these hypotheses remains a Gate 2/3 proof audit, not a Gate 1 statement fact.",
      "statement_disposition": "correspondence_accounted_for",
      "proof_disposition": "not_assessed"
    },
    {
      "formulation_id": "D",
      "external_claim_id": "OPENAI_2026_D",
      "analytical_source_statement": "Corollary 10.6",
      "lean_declaration": "NavierStokes.Comparator.navier_stokes_breakdown_periodic",
      "lean_target_summary": "For every positive viscosity, there exist periodic initial velocity and force data satisfying InitialVelocityConditionPeriodic and ForceConditionPeriodic such that no global NavierStokesExistenceAndSmoothnessPeriodic velocity/pressure pair exists.",
      "fields": [
        {"field_id": "dimension", "clay_requirement": "three spatial dimensions", "source_or_lean_encoding": "local notation ℝ³ := EuclideanSpace ℝ (Fin 3)", "relation": "exact_match", "audit_status": "accounted_for"},
        {"field_id": "viscosity", "clay_requirement": "nu > 0", "source_or_lean_encoding": "(nu : ℝ) (hnu : nu > 0)", "relation": "exact_match", "audit_status": "accounted_for"},
        {"field_id": "domain", "clay_requirement": "R^3/Z^3", "source_or_lean_encoding": "IsOnePeriodic encodes unit-periodicity in every coordinate, representing R^3/Z^3.", "relation": "exact_match", "audit_status": "accounted_for"},
        {"field_id": "initial_data", "clay_requirement": "there exists smooth divergence-free spatially periodic u0 satisfying Fefferman condition (8)", "source_or_lean_encoding": "InitialVelocityConditionPeriodic u₀ requires smoothness, divergence-free initial data, and unit spatial periodicity.", "relation": "exact_match", "audit_status": "accounted_for"},
        {"field_id": "forcing", "clay_requirement": "there exists smooth spatially periodic f with time decay satisfying Fefferman condition (9)", "source_or_lean_encoding": "ForceConditionPeriodic f requires smoothness, unit spatial periodicity for t ≥ 0, and all-order rapid time decay.", "relation": "exact_match", "audit_status": "accounted_for"},
        {"field_id": "equation", "clay_requirement": "Navier-Stokes momentum equation with forcing", "source_or_lean_encoding": "NavierStokesExistenceAndSmoothness.navier_stokes encodes ∂t v + (v·∇)v = nu Δv - ∇p + f on t ≥ 0.", "relation": "exact_match", "audit_status": "accounted_for"},
        {"field_id": "incompressibility", "clay_requirement": "div u = 0", "source_or_lean_encoding": "NavierStokesExistenceAndSmoothness.div_free requires divergence zero for all x and t ≥ 0.", "relation": "exact_match", "audit_status": "accounted_for"},
        {"field_id": "initial_condition", "clay_requirement": "u(x,0)=u0(x)", "source_or_lean_encoding": "NavierStokesExistenceAndSmoothness.initial_condition requires v x 0 = u₀ x.", "relation": "exact_match", "audit_status": "accounted_for"},